{"authoring_sha256":"05f561912767373ee8a60bc1a6bf47d4143db99d7c2c03567baed92733a2e446","bundle_sha256":"021ecfaa8211cc70163cb018af67715323c9f71d689099ee4c5c7d32c8706433","compiler_version":"metadata-domain-compiler.v6.3","contract_version":"domain.package.v1","domain_id":"order_sales","environment":"test","lifecycle":{"status":"validated"},"package_sha256":"fb2dc7218c2db3b7d0b142947823fe1c9a98527961406bf8f5f3cbb8302198ec","revision":1,"runtime_catalog":{"aliases":{"dataset:orders":{"target_key":"orders","target_type":"dataset","values":["주문","판매","매출 데이터"]},"dataset:products":{"target_key":"products","target_type":"dataset","values":["상품","제품 마스터"]},"dataset:refunds":{"target_key":"refunds","target_type":"dataset","values":["환불","반품"]},"dataset:targets":{"target_key":"targets","target_type":"dataset","values":["목표","매출 목표"]},"field:PRODUCT_ID":{"target_key":"PRODUCT_ID","target_type":"field","values":["상품","상품 ID"]},"field:PRODUCT_NAME":{"target_key":"PRODUCT_NAME","target_type":"field","values":["상품명","제품명"]},"metric:REFUND_AMOUNT":{"target_key":"REFUND_AMOUNT","target_type":"metric","values":["환불액","환불금액"]},"metric:SALES_AMOUNT":{"target_key":"SALES_AMOUNT","target_type":"metric","values":["매출","매출액","주문금액"]},"metric:TARGET_AMOUNT":{"target_key":"TARGET_AMOUNT","target_type":"metric","values":["목표","목표금액","목표액"]}},"catalog_sha256":"1aeb6fe468b61e6e13e8afe1b9796a27f05772ed72963ac71b507bbd86c98b68","compiler_version":"metadata-domain-compiler.v6.3","contract_version":"metadata.runtime.catalog.v2","datasets":{"orders":{"config_ref":"config:dummy:order_sales@1","date_policy":{"field":"ORDER_DATE","inclusive_end":true,"inclusive_start":true,"timezone":"Asia/Seoul"},"default_detail_fields":["ORDER_ID","ORDER_DATE","CUSTOMER_ID","PRODUCT_ID","SALES_AMOUNT"],"display_name":"주문","family":"sales_actual","fields":{"CUSTOMER_ID":{"aliases":["고객","고객 ID"],"coercion":"string","nullable":true,"physical_aliases":[],"physical_column":"customer_id","required_in_source":false,"roles":["filter","group","join","project","output"],"semantic_type":"identifier"},"ORDER_DATE":{"aliases":["주문일","날짜"],"coercion":"strict_date","nullable":false,"physical_aliases":[],"physical_column":"order_date","required_in_source":true,"roles":["filter","group","sort","project","output"],"semantic_type":"LocalDate","timezone":"Asia/Seoul"},"ORDER_ID":{"aliases":["주문번호","order id"],"coercion":"string","nullable":false,"physical_aliases":[],"physical_column":"order_id","required_in_source":true,"roles":["filter","join","project","output"],"semantic_type":"identifier"},"PRODUCT_ID":{"aliases":["상품","상품 ID"],"coercion":"string","nullable":false,"physical_aliases":[],"physical_column":"product_id","required_in_source":true,"roles":["filter","group","join","project","output"],"semantic_type":"identifier"},"SALES_AMOUNT":{"aliases":["매출","주문금액","판매금액"],"allowed_rollups":["sum","mean","min","max"],"coercion":"strict_number","nullable":false,"physical_aliases":[],"physical_column":"sales_amount","required_in_source":true,"roles":["filter","aggregate","compare","sort","rank","metric","project","output"],"semantic_type":"currency","unit":"KRW"}},"key":"orders","parameters":{"DATE_FROM":{"required":false,"type":"LocalDate"},"DATE_TO":{"required":false,"type":"LocalDate"}},"query_ref":"query:orders@1","read_policy":{"max_rows":50000,"read_only":true,"timeout_seconds":30},"source_adapter":"dummy.orders.v1","source_type":"dummy","time_scope":"history"},"products":{"config_ref":"config:dummy:order_sales@1","date_policy":{},"default_detail_fields":["PRODUCT_ID","PRODUCT_NAME","CATEGORY"],"display_name":"상품 마스터","family":"product_master","fields":{"CATEGORY":{"aliases":["카테고리","상품군"],"coercion":"string","nullable":true,"physical_aliases":[],"physical_column":"category","required_in_source":false,"roles":["filter","group","project","sort","output"],"semantic_type":"string"},"PRODUCT_ID":{"aliases":["상품","상품 ID"],"coercion":"string","nullable":false,"physical_aliases":[],"physical_column":"product_id","required_in_source":true,"roles":["filter","group","join","project","output"],"semantic_type":"identifier"},"PRODUCT_NAME":{"aliases":["상품명","제품명"],"coercion":"string","nullable":false,"physical_aliases":[],"physical_column":"product_name","required_in_source":true,"roles":["filter","group","project","sort","output"],"semantic_type":"string"}},"key":"products","parameters":{},"query_ref":"query:products@1","read_policy":{"max_rows":10000,"read_only":true,"timeout_seconds":30},"source_adapter":"dummy.products.v1","source_type":"dummy","time_scope":"current"},"refunds":{"config_ref":"config:dummy:order_sales@1","date_policy":{},"default_detail_fields":["ORDER_ID","PRODUCT_ID","REFUND_AMOUNT"],"display_name":"환불","family":"sales_refund","fields":{"ORDER_ID":{"aliases":["주문번호","order id"],"coercion":"string","nullable":false,"physical_aliases":[],"physical_column":"order_id","required_in_source":true,"roles":["filter","join","project","output"],"semantic_type":"identifier"},"PRODUCT_ID":{"aliases":["상품","상품 ID"],"coercion":"string","nullable":false,"physical_aliases":[],"physical_column":"product_id","required_in_source":true,"roles":["filter","group","join","project","output"],"semantic_type":"identifier"},"REFUND_AMOUNT":{"aliases":["환불액","환불금액"],"allowed_rollups":["sum","mean","min","max"],"coercion":"strict_number","nullable":false,"physical_aliases":[],"physical_column":"refund_amount","required_in_source":true,"roles":["filter","aggregate","compare","sort","rank","metric","project","output"],"semantic_type":"currency","unit":"KRW"}},"key":"refunds","parameters":{},"query_ref":"query:refunds@1","read_policy":{"max_rows":50000,"read_only":true,"timeout_seconds":30},"source_adapter":"dummy.refunds.v1","source_type":"dummy","time_scope":"history"},"targets":{"config_ref":"config:dummy:order_sales@1","date_policy":{"field":"TARGET_DATE","inclusive_end":true,"inclusive_start":true,"timezone":"Asia/Seoul"},"default_detail_fields":["TARGET_DATE","PRODUCT_ID","TARGET_AMOUNT"],"display_name":"상품별 매출 목표","family":"sales_target","fields":{"PRODUCT_ID":{"aliases":["상품","상품 ID"],"coercion":"string","nullable":false,"physical_aliases":[],"physical_column":"product_id","required_in_source":true,"roles":["filter","group","join","project","output"],"semantic_type":"identifier"},"TARGET_AMOUNT":{"aliases":["매출목표","목표금액","목표액"],"allowed_rollups":["sum","min","max"],"coercion":"strict_number","nullable":false,"physical_aliases":[],"physical_column":"target_amount","required_in_source":true,"roles":["filter","aggregate","compare","sort","rank","metric","project","output"],"semantic_type":"currency","unit":"KRW"},"TARGET_DATE":{"aliases":["목표일","기준일","날짜"],"coercion":"strict_date","nullable":false,"physical_aliases":[],"physical_column":"target_date","required_in_source":true,"roles":["filter","group","join","sort","project","output"],"semantic_type":"LocalDate","timezone":"Asia/Seoul"}},"key":"targets","parameters":{"DATE_FROM":{"required":false,"type":"LocalDate"},"DATE_TO":{"required":false,"type":"LocalDate"}},"query_ref":"query:targets@1","read_policy":{"max_rows":10000,"read_only":true,"timeout_seconds":30},"source_adapter":"dummy.targets.v1","source_type":"dummy","time_scope":"history"}},"description":"제조 공정과 무관한 범용성 검증을 위한 주문, 상품, 환불, 목표 데이터 도메인입니다.","display_name":"주문·매출 분석","domain_id":"order_sales","entity_groups":{"all_products":{"aliases":["전체 상품","모든 상품"],"entity":"PRODUCT_ID","group_id":"all_products","selection":{"operator":"all_registered"}},"electronics_category":{"aliases":["전자 카테고리","전자 상품군"],"group_id":"electronics_category","selection":{"operator":"eq","semantic_type":"string","value":"A"},"target_field":"CATEGORY"},"living_category":{"aliases":["생활 카테고리","생활 상품군"],"group_id":"living_category","selection":{"operator":"eq","semantic_type":"string","value":"B"},"target_field":"CATEGORY"}},"environment":"test","fields":{"CATEGORY":{"aliases":["상품군","카테고리"],"canonical_field":"CATEGORY","dataset_keys":["products"],"roles":["filter","group","output","project","sort"],"semantic_type":"string"},"CUSTOMER_ID":{"aliases":["고객","고객 ID"],"canonical_field":"CUSTOMER_ID","dataset_keys":["orders"],"roles":["filter","group","join","output","project"],"semantic_type":"identifier"},"ORDER_DATE":{"aliases":["날짜","주문일"],"canonical_field":"ORDER_DATE","dataset_keys":["orders"],"roles":["filter","group","output","project","sort"],"semantic_type":"LocalDate"},"ORDER_ID":{"aliases":["order id","주문번호"],"canonical_field":"ORDER_ID","dataset_keys":["orders","refunds"],"roles":["filter","join","output","project"],"semantic_type":"identifier"},"PRODUCT_ID":{"aliases":["상품","상품 ID"],"canonical_field":"PRODUCT_ID","dataset_keys":["orders","products","refunds","targets"],"roles":["filter","group","join","output","project"],"semantic_type":"identifier"},"PRODUCT_NAME":{"aliases":["상품명","제품명"],"canonical_field":"PRODUCT_NAME","dataset_keys":["products"],"roles":["filter","group","output","project","sort"],"semantic_type":"string"},"REFUND_AMOUNT":{"aliases":["환불금액","환불액"],"canonical_field":"REFUND_AMOUNT","dataset_keys":["refunds"],"roles":["aggregate","compare","filter","metric","output","project","rank","sort"],"semantic_type":"currency"},"SALES_AMOUNT":{"aliases":["매출","주문금액","판매금액"],"canonical_field":"SALES_AMOUNT","dataset_keys":["orders"],"roles":["aggregate","compare","filter","metric","output","project","rank","sort"],"semantic_type":"currency"},"TARGET_AMOUNT":{"aliases":["매출목표","목표금액","목표액"],"canonical_field":"TARGET_AMOUNT","dataset_keys":["targets"],"roles":["aggregate","compare","filter","metric","output","project","rank","sort"],"semantic_type":"currency"},"TARGET_DATE":{"aliases":["기준일","날짜","목표일"],"canonical_field":"TARGET_DATE","dataset_keys":["targets"],"roles":["filter","group","join","output","project","sort"],"semantic_type":"LocalDate"}},"grains":{"customer":{"grain_id":"customer","keys":["CUSTOMER_ID"]},"date_product":{"grain_id":"date_product","keys":["TARGET_DATE","PRODUCT_ID"]}